<?xml version="1.0"?>
<!DOCTYPE profile SYSTEM "/usr/share/autoinstall/dtd/profile.dtd">
<profile xmlns="http://www.suse.com/1.0/yast2ns" xmlns:config="http://www.suse.com/1.0/configns">
    <networking>
      <dns>
        <dhcp_hostname config:type="boolean">true</dhcp_hostname>
        <dhcp_resolv config:type="boolean">true</dhcp_resolv>
      </dns>
      <interfaces config:type="list">
        <interface>
          <bootproto>dhcp</bootproto>
          <device>eth0</device>
          <name>Ethernet Network Card</name>
          <startmode>auto</startmode>
          <usercontrol>no</usercontrol>
        </interface>
      </interfaces>
      <modules config:type="list">
        <module_entry>
          <device>static-0</device>
          <module></module>
          <options></options>
        </module_entry>
      </modules>
      <routing>
        <ip_forward config:type="boolean">false</ip_forward>
      </routing>
    </networking>
  <!--
    <software>
      <base>Min</base>
    </software>
    -->
     <software>
       <base>default</base>
     </software>
    <users config:type="list">
      <user>
        <encrypted config:type="boolean">true</encrypted>
        <user_password>pw</user_password>
        <username>root</username>
      </user>
    </users>
    <scripts>
        <pre-scripts config:type="list">
        <script>
                <filename>pre</filename>
                <interpreter>shell</interpreter>
                <location></location>
                <feedback config:type="boolean">true</feedback>
                <debug config:type="boolean">false</debug>
                <source><![CDATA[
echo "hda1 - kept"
cho "this is stderr"
echo "hda2 - removed and 2 new ones are created"
DEVICE="hda";
parted --script /dev/${DEVICE} rm 2
echo -e "n\n p\n 2\n\n +10G\n n\n p\n 3\n\n\n w\n" | fdisk /dev/$DEVICE
                ]]></source> 
        </script>
        </pre-scripts>
    </scripts>
  <partitioning config:type="list">
      <drive>
        <device>/dev/hda</device>
        <initialize config:type="boolean">false</initialize>
        <partitions config:type="list">
          <partition>
            <filesystem config:type="symbol">ext3</filesystem>
            <format config:type="boolean">true</format>
            <mount>/</mount>
            <partition_id config:type="integer">131</partition_id>
            <partition_type>primary</partition_type>
            <size>3513M</size>
          </partition>
          <partition>
            <format config:type="boolean">true</format>
            <partition_id config:type="integer">253</partition_id>
            <partition_type>primary</partition_type>
            <size>max</size>
          </partition>
        </partitions>
        <use>all</use>
      </drive>
  </partitioning>
</profile>
