<?xml version="1.0"?>
<!DOCTYPE profile SYSTEM "/usr/share/autoinstall/dtd/profile.dtd">
<profile xmlns="http://www.suse.com/1.0/yast2ns" xmlns:config="http://www.suse.com/1.0/configns">
  <configure>
    <sound>
      <autoinstall config:type="boolean">true</autoinstall>
      <configure_detected config:type="boolean">true</configure_detected>
    </sound>
    <networking>
      <dns>
        <dhcp_hostname config:type="boolean">true</dhcp_hostname>
        <dhcp_resolv config:type="boolean">true</dhcp_resolv>
        <domain>aaa.cc</domain>
        <hostname>aaa</hostname>
      </dns>
      <interfaces config:type="list">
        <interface>
          <bootproto>dhcp</bootproto>
          <device>eth0</device>
          <name>Ethernet Network Card</name>
          <startmode>auto</startmode>
          <usercontrol>no</usercontrol>
        </interface>
      </interfaces>
      <modules config:type="list">
        <module_entry>
          <device>static-0</device>
          <module></module>
          <options></options>
        </module_entry>
      </modules>
      <routing>
        <ip_forward config:type="boolean">false</ip_forward>
      </routing>
    </networking>
  </configure>
  <install>
    <partitioning_advanced>
      <fstab>
    <!-- Read data from existing fstab. If multiple root partitions are
    found, use the one specified below. Otherwise the first root
    partition is taken -->
<!--    <root_partition>/dev/sda2</root_partition> -->
    <use_existing_fstab config:type="boolean">true</use_existing_fstab>
    <!-- all partitions found in fstab will be formatted and mounted
    by default unless a partition is listed below with different
    settings -->
    <partitions config:type="list">
      <partition>
        <create config:type="boolean">true</create>
        <format config:type="boolean">true</format>
        <mount>swap</mount>
      </partition>
      <partition>
        <format config:type="boolean">true</format>
        <mount>/</mount>
      </partition>
    </partitions>
      </fstab>
    </partitioning_advanced>
    <software>
<!--      <base>Min</base> -->
    </software>
    <users config:type="list">
      <user>
        <encrypted config:type="boolean">true</encrypted>
        <user_password>pw</user_password>
        <username>root</username>
      </user>
    </users>
  </install>
</profile>
